MedicineName,Old price,NewPrice,Quantity,Stars,Rating,Discount,Description
Baidyaraj Ayurvedic Bhavan RHEUMA GOLD MAJOON PACK OF -...,₹960,₹500,3 x 200 g,0,0,47% off,Bank Offer
"Eazybits Chanda Ayurvedic Pharmacy, Chanda Goli, Chanda...",₹888,₹399,4 x 40 Units,0,0,55% off,Bank Offer
Eazybits 14 sachets Gopal Herbals Pain Nil Powder Powde...,₹499,₹157,14 x 1 Patches,3.7,(15),68% off,Bank Offer
"GO365 Nutra Tablets For Joint Pain, Stiffness And Osteo...",₹431,₹275,30 Units,4.1,(172),36% off,Bank Offer
Kerala Ayurveda Myaxyl Oil Combo Pack of 3 Liquid,₹360,₹244,3 x 60 ml,4.3,(85),32% off,Bank Offer
Eazybits 42 sachets Gopal Herbals Pain Nil Powder Powde...,₹899,₹319,42 x 1 Units,4,(21),64% off,Bank Offer
MY Dr. Pain Relief Multi Combo Pack - Oil (60 ml) + Cre...,₹503,₹328,3 x 56.67 ml,4.3,(195),34% off,Bank Offer
"Eazybits Sandhi Sukh Powder, Joint and Muscle Pain(28 p...",₹899,₹391,28 x 1 Units,0,0,56% off,Bank Offer
Eazybits Pain Cure Gold Tablet pack of (6 x 40 Units) T...,"₹1,499",₹630,6 x 40 Units,0,0,57% off,Bank Offer
Eazybits Gopal Herbals Pain Nil Powder (42 sachets) Pow...,₹899,₹319,42 x 1 Units,0,0,64% off,Bank Offer
ORTHO AID Joint Pain Relief Oil Pack of 2 ( 100 ml Each...,₹570,₹333,2 x 50 ml,4.4,(98),41% off,Bank Offer
"Dr. Ortho Pain Relief (Oil, Cap, Spray & Ointment) Liqu...",₹721,₹549,4 x 1,4.1,"(1,859)",23% off,Bank Offer
Eazybits Gopal Herbals Pain Nil Powder (60 sachets) Pow...,₹899,₹399,60 x 1 Units,4.3,(48),55% off,Bank Offer
Forestreasures Optimove Pain Relief Gel | Help Relieve ...,₹150,₹108,50 g,0,0,28% off,Bank Offer
Menthodex Pain Balm Balm,₹490,₹359,2 x 50 g,4.4,"(1,003)",26% off,Bank Offer
Eazybits Orthonil Ortho pai Nil Powder Joint Pain Relie...,"₹1,399",₹598,70 x 1 Units,4.3,(73),57% off,Bank Offer
Quickbits Dard mukti powder-14 pieces Powder,₹599,₹159,14 x 1 Units,0,0,73% off,Bank Offer
Tiger Balm Red & White Ointment Balm,₹282,₹213,6 x 9 ml,4.3,(23),24% off,Bank Offer
"Jain Pain Off Oil 100ml, (100% Natural Ayurvedic Oil) L...",₹372,₹282,2 x 100 ml,4.7,(20),24% off,Bank Offer
Asclepius Cough Doc Ras (200) Liquid,₹495,₹319,200 g,4.2,(35),35% off,Bank Offer
Dr. Ortho AYURVEDIC JOINT PAIN MASSAGE Oil (Pack of 1) ...,₹295,₹224,120 ml,4.2,(725),24% off,Bank Offer
Dr. Ortho Ayurvedic Joint Pain Massage Oil Liquid Pack ...,₹590,₹459,2 x 120 ml,4.3,"(5,720)",22% off,Bank Offer
Eazybits New Ortho Power Tablets (40 Tabs) Pack of 4 Bo...,"₹1,299",₹399,4 x 40 Units,0,0,69% off,Bank Offer
Dr. Ortho Ayurvedic Pain Relieving Gel (Pack of 2) Balm,₹156,₹124,2 x 15 g,4.1,(610),20% off,Bank Offer
Dr. Ortho Joint Pain Relief Oil 120ml - Ayurvedic Joint...,₹295,₹224,120 ml,4.2,"(29,251)",24% off,Bank Offer
Dr. Ortho Joint Pain Relief Ayurvedic Oil 120ml Liquid,₹295,₹224,120 ml,4.3,"(1,223)",24% off,Bank Offer
Axe Brand Brand Universal Oil (Made in Singapore) Origi...,"₹1,200",₹255,2 x 2.5 ml,3.7,(3),78% off,Bank Offer
Gynocup Feminine Cramp Relief Roll On All in One (Perio...,₹398,₹179,2 x 10 ml,4,(215),55% off,Bank Offer
"Deep Heat Spray, Fast Relief - 150ml Spray",₹599,₹445,150 ml,4,(160),25% off,Bank Offer
"GREEN CURE Arnicap Herbal Pain Relief Gel, AYUSH Certif...",₹179,₹102,30 g,4.1,(426),43% off,"Buy 3 items, save extra 5%"
"Eazybits New Ortho Power Tablet, For Joint Pain,(6 x 40...",₹999,₹549,6 x 40 Units,4.8,(9),45% off,Bank Offer
Eazybits Ortho Nil Powder Babaji Herbals 70pc Powder,"₹1,499",₹598,70 x 1 Units,4.2,(11),60% off,Bank Offer
Forest Secrets Optimove Pain Relief Spray | Natural Mus...,₹299,₹239,80 g,0,0,20% off,Bank Offer
Alphacia Dard Go Pain Relief Oil Pack of 3 Liquid,₹897,₹200,3 x 60 ml,4.3,(7),77% off,Bank Offer
"Eazybits Chanda Ayurvedic Pharmacy, Chanda Goli, Chanda...",₹888,₹399,4 x 40 Units,0,0,55% off,Bank Offer
Eazybits 14 sachets Gopal Herbals Pain Nil Powder Powde...,₹499,₹157,14 x 1 Patches,3.7,(15),68% off,Bank Offer
Eazybits 42 sachets Gopal Herbals Pain Nil Powder Powde...,₹899,₹319,42 x 1 Units,4,(21),64% off,Bank Offer
PATANJALI BALM 25GM PACK OF 2 Balm,₹180,₹144,2 x 25 g,4.3,(264),20% off,Bank Offer
Orthomol An effective Pain Reliever Joint & Muscular Pa...,₹265,₹177,100 ml,4.3,(105),33% off,Bank Offer
HIMALAYA Pilex Tablets Capsules,₹200,₹152,60 g,3.8,(506),24% off,Bank Offer
"MY Dr. Pain Relief Oil (60 ml) , Cream (60 g) Combo Pac...",₹328,₹228,120 g,4.4,(89),30% off,Bank Offer
Eazybits Gopal Herbals Pain Nil Powder (60 sachets) Pow...,₹899,₹399,60 x 1 Units,4.3,(48),55% off,Bank Offer
Rheuma-Q Rheuma Q Capsules (30 Capsules X 2 = 60 Capsul...,₹496,₹278,2 x 1 Units,4.6,(5),43% off,Bank Offer
Orthayu All joint Pain Relief Balm and Joint Pain Oil C...,"₹2,700","₹1,688",3 x 1 Units,0,0,37% off,Bank Offer
Eazybits Dard mukti pain relief powder ayurvedic 42 pou...,₹799,₹359,42 x 1 Units,4.5,(17),55% off,Bank Offer
"Dr. Ortho Pain Relief (Oil, Cap, Spray & Ointment) Liqu...",₹721,₹549,4 x 1,4.1,"(1,859)",23% off,Bank Offer
Gold Medal Medicated Oil 3ml Pack of 4 {IMPORTED SINGAP...,₹749,₹598,4 x 0.75 ml,4.3,(98),20% off,Bank Offer
Forestreasures Optimove Pain Relief Tablets | Symptomat...,₹699,₹529,60 Units,0,0,24% off,Bank Offer
Tiger Balm Oil #IMPORTED Liquid,₹800,₹344,15 ml,0,0,56% off,Bank Offer
DR Relaxi Rajasthan Herbals Caspule (Ayurvedic) for Joi...,₹630,₹520,2 x 1 Units,4.3,(35),17% off,Bank Offer
Eazybits Orthonil Ortho pai Nil Powder Joint Pain Relie...,"₹1,399",₹598,70 x 1 Units,4.3,(73),57% off,Bank Offer
DEEMARK Ortho Pain Relief Balm,₹160,₹120,100 ml,3.9,(533),25% off,Bank Offer
OMEGA Pain Killer Liniment oil- 120ML Liquid,"₹1,000",₹555,120 ml,4,(68),44% off,Bank Offer
"HIMALAYA COLD BALM RAPID ACTION 45g Each, Pack of 4 Bal...",₹500,₹348,4 x 45 g,0,0,30% off,Bank Offer
Eazybits Ayurvedic Ortho Power Tablet (6 x 40 Units) Ta...,"₹1,299",₹549,6 x 40 Units,4.6,(7),57% off,Bank Offer
Dr. Ortho AYURVEDIC JOINT PAIN MASSAGE Oil (Pack of 1) ...,₹295,₹224,120 ml,4.2,(725),24% off,Bank Offer
Gold Medal Medicated Oil 3ml Pack of 4 {IMPORTED SINGAP...,₹820,₹695,4 x 3 ml,3.4,(7),15% off,Bank Offer
Axe Brand MEDICATED IMPORTED OIL Liquid,₹777,₹303,14 ml,0,0,61% off,Bank Offer
Icy Hot Extra Strength Pain Relieving Balm,"₹3,000","₹1,950",99.2 g,0,0,35% off,Bank Offer
Quickbits 14 POUCH Orthonil Powder Ayurvedic for Joint/...,₹499,₹159,14 x 1 Units,0,0,68% off,Bank Offer
Dr. Ortho Ayurvedic Joint Pain Massage Oil Liquid Pack ...,₹590,₹459,2 x 120 ml,4.3,"(5,718)",22% off,Bank Offer
"Dr. Ortho Pain Relief (120ml Oil, 30 Capsule, 75ml Spra...",₹721,₹549,4 x 1,4.1,(190),23% off,Bank Offer
West Coast Veinneed Varicose Vein Gel with Red Wine Lea...,₹200,₹160,200 g,4.2,(14),20% off,Bank Offer
Element FEALING CAPSULE 60 Capsules,₹775,₹449,60 Units,0,0,42% off,Bank Offer
Dr. Ortho Joint Pain Relief Oil 120ml - Ayurvedic Joint...,₹295,₹224,120 ml,4.2,"(29,208)",24% off,Bank Offer
Dr. Ortho Joint Pain Relief Ayurvedic Oil 120ml Liquid,₹295,₹224,120 ml,4.2,"(1,212)",24% off,Bank Offer
VEDIVA Knee & Muscle Pain Pack Of 2 Balm,"₹1,990","₹1,505",2 x 100 g,4.1,(16),24% off,Bank Offer
Eazybits Orthonil Ortho pai Nil Powder Joint Pain Relie...,₹999,₹499,56 x 1 Units,3.9,(7),50% off,Bank Offer
COSIFY Pilen Cream ( PilesRelief ) - Set of 3 Cream,₹285,₹228,3 x 25 g,0,0,20% off,Bank Offer
looloo Oleo Rheuma Joint Pain Relief Oil Liquid,₹199,₹143,15 ml,3.7,(36),28% off,Bank Offer
Kwik Pain Relieving Oil for Joint Pain Liquid,₹283,₹159,120 ml,4.2,"(1,983)",43% off,Bank Offer
"Eazybits New Ortho Power Tablet, For Joint Pain,(6 x 40...",₹999,₹549,6 x 40 Units,4.8,(9),45% off,Bank Offer
Eazybits Artho veda Powder Joint Pain Relief Powder (pa...,₹999,₹399,49 x 1 Units,4.5,(4),60% off,Bank Offer
Eazybits Artho veda powder Ayurvedic herbal for jont pa...,"₹1,299",₹769,80 x 1 Units,0,0,40% off,Bank Offer
Eazybits Ortho Nil Powder Babaji Herbals 70pc Powder,"₹1,499",₹598,70 x 1 Units,4.2,(11),60% off,Bank Offer
"Eazybits Chanda Ayurvedic Pharmacy, Chanda Goli, Chanda...",₹888,₹399,4 x 40 Units,0,0,55% off,Bank Offer
Basic Ayurveda Jod Bejod Joint Pain Relief Oil Liquid,₹440,₹351,2 x 100 ml,4.7,(6),20% off,Bank Offer
APSARA HERBAL Roghan Sukoon massage oil 500g Liquid,₹560,₹399,500 ml,4.3,(3),28% off,Bank Offer
DEEMARK Ortho Balm-50 Grams (Pack of 5) Balm,₹800,₹645,5 x 50 g,0,0,19% off,Bank Offer
Sloan's LINIMENT Genuine Medicated Oil for Muscular Pai...,₹599,₹399,70 ml,3.3,(3),33% off,Bank Offer
Eazybits 14 sachets Gopal Herbals Pain Nil Powder Powde...,₹499,₹157,14 x 1 Patches,3.7,(15),68% off,Bank Offer
"MY Dr. Pain Relief Oil (60 ml) , Cream (60 g) Combo Pac...",₹328,₹228,120 g,4.4,(89),30% off,Bank Offer
Dipan Herbal Rheuma-Q Pack of 2 (30+30) Capsules,₹496,₹291,2 x 50 g,4.4,(44),41% off,Bank Offer
Kudos Ayurveda V-1 PLUS OIL Liquid,₹360,₹273,2 x 30 ml,4.1,(134),24% off,Bank Offer
Eazybits 42 sachets Gopal Herbals Pain Nil Powder Powde...,₹899,₹319,42 x 1 Units,4,(21),64% off,Bank Offer
MY Dr. Pain Relief Multi Combo Pack - Oil (60 ml) + Cre...,₹503,₹328,3 x 56.67 ml,4.3,(195),34% off,Bank Offer
Orthayu Pain Relief Instant relief ayurvedic gel Balm,"₹1,990","₹1,590",2 x 101.5 g,0,0,20% off,Bank Offer
Eazybits Dardmukti Powder Dard Mukti Powder Ayurvedic H...,₹799,₹367,42 x 1 Units,0,0,54% off,Bank Offer
HIMALAYA Pain Relief Oil (Pack of 1) Liquid,₹200,₹136,100 g,4.2,(88),32% off,Bank Offer
Adam Zac 3 Bottles Liquid,₹900,₹315,3 x 3 ml,4.8,(8),65% off,Bank Offer
Eazybits Dard mukti pain relief powder ayurvedic 42 pou...,₹799,₹359,42 x 1 Units,4.5,(17),55% off,Bank Offer
"Dr. Ortho Pain Relief (Oil, Cap, Spray & Ointment) Liqu...",₹721,₹549,4 x 1,4.1,"(1,858)",23% off,Bank Offer
Kudos V1 Tablets Capsules,"₹1,200","₹1,049",4 x 60 g,3.7,(3),12% off,Bank Offer
OMEGA Pain Killer Liniment Gel,₹800,₹379,60 ml,4.1,(70),52% off,Bank Offer
Eazybits Gopal Herbals Pain Nil Powder (60 sachets) Pow...,₹899,₹399,60 x 1 Units,4.3,(48),55% off,Bank Offer
Eazybits Orthonil Ortho pai Nil Powder Joint Pain Relie...,"₹1,399",₹598,70 x 1 Units,4.3,(73),57% off,Bank Offer
Austro Labs Austro Pain Oil - 60 ml Liquid,₹155,₹111,60 ml,4.3,(91),28% off,Bank Offer
Quik Relif Herbal Oil 50ml & Spray 55g with (2) Balm 10...,₹400,₹265,4 x 31.25 g,0,0,33% off,Bank Offer
Quickbits PAIN NIL TABLETS 40 TABLETS 1 PACK Tablets (1...,₹300,₹159,40 Units,0,0,47% off,Bank Offer
Eazybits Orthonil Ortho pai Nil Powder Joint Pain Relie...,"₹1,299",₹599,77 x 1 Units,4.2,(5),53% off,Bank Offer
Dr. Ortho AYURVEDIC JOINT PAIN MASSAGE Oil (Pack of 1) ...,₹295,₹224,120 ml,4.2,(725),24% off,Bank Offer
Dr. Ortho Ayurvedic Joint Pain Massage Oil Liquid Pack ...,₹590,₹459,2 x 120 ml,4.3,"(5,720)",22% off,Bank Offer
homeobuy SBL'S LivT Liver Tonic - 500 ml(Pack of 2) Liq...,₹630,₹498,2 x 500 ml,3.4,(9),20% off,Bank Offer
counterpain Analgesic Balm Cream (120 g) Cream,₹899,₹510,120 g,4.3,(177),43% off,Bank Offer
Dr. Ortho Joint Pain Relief Oil 120ml - Ayurvedic Joint...,₹295,₹224,120 ml,4.2,"(29,208)",24% off,Bank Offer
Dr. Ortho Joint Pain Relief Ayurvedic Oil 120ml Liquid,₹295,₹224,120 ml,4.2,"(1,212)",24% off,Bank Offer
SCORTIS HEALTH CARE Vein Relex Varicose Veins Spider Ve...,₹360,₹288,50 ml,0,0,20% off,"Buy 3 items, save extra 5%"
PATANJALI BALM 25GM PACK OF 2 Balm,₹180,₹144,2 x 25 g,4.3,(264),20% off,Bank Offer
Orthomol An effective Pain Reliever Joint & Muscular Pa...,₹265,₹177,100 ml,4.3,(105),33% off,Bank Offer
Poy Sian Menthol Nasal InhalerDouble-Sided for Smell an...,₹600,₹260,3 x 2 ml,0,0,56% off,Bank Offer
"Eazybits New Ortho Power Tablet, For Joint Pain,(6 x 40...",₹999,₹549,6 x 40 Units,4.8,(9),45% off,Bank Offer
Eazybits Ortho Nil Powder Babaji Herbals 70pc Powder,"₹1,499",₹598,70 x 1 Units,4.2,(11),60% off,Bank Offer
AKISON 70 Sachet Dard Mukti Powder Original Powder Powd...,"₹1,190",₹516,70 x 1 Units,0,0,56% off,Bank Offer
HAPDCO REUMATONE PAIN KILLER PACK OF 3 ( EACH OF 60 ML ...,₹510,₹332,3 x 60 ml,4.1,(169),34% off,Bank Offer
"Eazybits Chanda Ayurvedic Pharmacy, Chanda Goli, Chanda...",₹888,₹399,4 x 40 Units,0,0,55% off,Bank Offer
Eazybits 14 sachets Gopal Herbals Pain Nil Powder Powde...,₹499,₹157,14 x 1 Patches,3.7,(15),68% off,Bank Offer
Eazybits Ortho nil powder Ayurvedic herbal for jont pai...,"₹1,599",₹799,105 x 1 Units,3.7,(7),50% off,Bank Offer
Homeolav | Bios Lab HEIGHTEX TABLETS | PACK of 4 Tablet...,₹480,₹319,4 x 1 Units,3.6,(14),33% off,Bank Offer
Deep Heat Pain Relief Spray #Imported [ Pack oF 2 ] Spr...,"₹1,300",₹891,2 x 75 ml,4.2,(69),31% off,Bank Offer
Eazybits 70 sachets Dard Mukti Powder FOR JOINT PAIN BO...,"₹1,299",₹599,70 x 1 Units,0,0,53% off,Bank Offer
Eazybits 42 sachets Gopal Herbals Pain Nil Powder Powde...,₹899,₹319,42 x 1 Units,4,(21),64% off,Bank Offer
Eazybits Gopal Herbals Pain Nil Powder (60 sachets) Pow...,₹899,₹399,60 x 1 Units,4.3,(48),55% off,Bank Offer
Shriram Natural No Addiction Plus Drop Liquid,"₹4,500","₹1,585",5 x 30 ml,3.5,(120),64% off,"Buy 3 items, save extra 5%"
homeobuy SBL'S LivT Liver Tonic - 180ml(Pack of 2) Liqu...,₹325,₹246,2 x 180 ml,4.5,(13),24% off,Bank Offer
Eazybits Dard mukti pain relief powder ayurvedic 42 pou...,₹799,₹359,42 x 1 Units,4.5,(17),55% off,Bank Offer
MY Dr. Pain Relief Multi Combo Pack - Oil (60 ml) + Cre...,₹503,₹328,3 x 56.67 ml,4.3,(195),34% off,Bank Offer
B & T Pain Relief Oil 60ml Pack of 3 Liquid,₹400,₹288,3 x 20 ml,4.3,(8),28% off,Bank Offer
Omkara Hills Orthomate Pain Relief Oil | 300ml (Pack of...,₹687,₹410,3 x 100 ml,0,0,40% off,"Buy 3 items, save extra 5%"
Rheuma-Q Rheuma Q Capsules (30 Capsules) Capsules,₹248,₹192,1 Units,4.7,(6),22% off,Bank Offer
Eazybits Artho veda powder Ayurvedic herbal for jont pa...,"₹2,999","₹2,099",280 x 1 Units,0,0,30% off,Bank Offer
"MY Dr. Pain Relief Oil (60 ml) , Cream (60 g) Combo Pac...",₹328,₹228,120 g,4.4,(89),30% off,Bank Offer
"Dr. Ortho Pain Relief (Oil, Cap, Spray & Ointment) Liqu...",₹721,₹549,4 x 1,4.1,"(1,858)",23% off,Bank Offer
Sensur Natural & Ayurvedic Pain Relief Oil Roll On -(10...,₹116,₹79,1 Units,4.4,(101),31% off,Bank Offer
Quickbits 140 Sachets Dardmukti Powder Dard Mukti Powde...,"₹2,599","₹1,199",140 x 1 Units,0,0,53% off,Bank Offer
Eazybits Orthonil Ortho pai Nil Powder Joint Pain Relie...,"₹1,399",₹598,70 x 1 Units,4.3,(73),57% off,Bank Offer
DEEMARK Ortho Pain Relief Balm,₹160,₹120,100 ml,3.9,(533),25% off,Bank Offer
JENI ENTERPRISE Dr. Ortho Balm 40gm(Pack of 3)100% Ayur...,₹599,₹421,3 x 1 g,0,0,29% off,Bank Offer
healofy Naturals Leg & Feet Gel and Sore Muscle Pain Re...,₹898,₹507,2 x 80 g,0,0,43% off,Bank Offer
AKISON Pain Cure Gold Tablets ( 2 Bottles x 40 tablets ...,₹145,₹97,40 Units,0,0,33% off,Bank Offer
DEEMARK Ortho Balm 50gm+Ortho Oil 50ml Pack of 3 Balm,₹405,₹300,3 x 16.67 ml,5,(5),25% off,Bank Offer
Eazybits Ayurvedic Ortho Power Tablet (6 x 40 Units) Ta...,"₹1,299",₹549,6 x 40 Units,4.6,(7),57% off,Bank Offer
Dr. Ortho AYURVEDIC JOINT PAIN MASSAGE Oil (Pack of 1) ...,₹295,₹224,120 ml,4.2,(725),24% off,Bank Offer
Eazybits 14 sachets Gopal Herbals Pain Nil Powder Powde...,₹349,₹159,14 x 1 Units,4.5,(23),54% off,Bank Offer
Eazybits Artho veda Powder Joint Pain Relief Powder (pa...,"₹1,199",₹399,42 x 1 Units,3.8,(5),66% off,Bank Offer
Dr. Ortho Joint Pain Relief Oil 120ml - Ayurvedic Joint...,₹295,₹224,120 ml,4.2,"(29,208)",24% off,Bank Offer
Dr. Ortho Joint Pain Relief Ayurvedic Oil 120ml Liquid,₹295,₹224,120 ml,4.3,"(1,223)",24% off,Bank Offer
Solan Liniment Oil (70 ml) Liquid,₹599,₹319,70 ml,3.8,(16),46% off,Bank Offer
Orthomol Ayurvedic Spray for Pain Relief 55 gm Spray (P...,₹350,₹252,2 x 55 g,4.3,(19),28% off,Bank Offer
Pee Safe Feminine Cramp Relief Roll on with Ayurveda Ex...,₹597,₹287,3 x 1 Units,4.2,(936),51% off,Bank Offer
VEDIVA Orthoayu Knee Relief Pain Balm,"₹1,990","₹1,505",2 x 100 g,3.9,(123),24% off,Bank Offer
"Eazybits New Ortho Power Tablet, For Joint Pain,(6 x 40...",₹999,₹549,6 x 40 Units,4.8,(9),45% off,Bank Offer
Eazybits Ortho Nil Powder Babaji Herbals 70pc Powder,"₹1,499",₹598,70 x 1 Units,4.2,(11),60% off,Bank Offer
"Moo Tong Embrocation oil, 60ml Pack of 1 Made in singap...","₹1,499",₹505,60 ml,4.7,(14),66% off,Bank Offer
"FlexiQule Natural Care For Osteoarthritis, Joint Stiffn...",₹199,₹143,10 Units,4.6,(8),28% off,Bank Offer
"Eazybits Chanda Ayurvedic Pharmacy, Chanda Goli, Chanda...",₹888,₹399,4 x 40 Units,0,0,55% off,Bank Offer
Eazybits 14 sachets Gopal Herbals Pain Nil Powder Powde...,₹499,₹157,14 x 1 Patches,3.7,(15),68% off,Bank Offer
Mediwrap Belladonna Pain Relief Plaster (Pack of 30) Pl...,₹480,₹280,30 x 1 Patches,4,(44),41% off,Bank Offer
Kesri Marham Balm Strong & Effective 100g (Pack of 6) B...,"₹1,560","₹1,452",6 x 100 g,0,0,6% off,Bank Offer
IMC Balm Balm,₹150,₹120,30 g,4.4,(22),20% off,Bank Offer
"Dr. Ortho Joint Pain relief oil, 60ml (Helpful in Joint...",₹158,₹126,60 ml,4.1,(616),20% off,Bank Offer
Eazybits 42 sachets Gopal Herbals Pain Nil Powder Powde...,₹899,₹319,42 x 1 Units,4,(21),64% off,Bank Offer
MY Dr. Pain Relief Multi Combo Pack - Oil (60 ml) + Cre...,₹503,₹328,3 x 56.67 ml,4.3,(195),34% off,Bank Offer
Tiger Balm Pain relief Neck & Shoulder Rub Boost - 50g ...,"₹1,495",₹590,50 g,4.9,(22),60% off,Bank Offer
"KISRA Grass Ayurvedic Pain relief Oil For Body, Back, K...",₹260,₹196,2 x 50 ml,4.3,(91),24% off,Bank Offer
"MY Dr. Pain Relief Oil (60 ml) , Cream (60 g) Combo Pac...",₹328,₹228,120 g,4.4,(89),30% off,Bank Offer
Eazybits Dard mukti pain relief powder ayurvedic 42 pou...,₹799,₹359,42 x 1 Units,4.5,(17),55% off,Bank Offer
TEACHERS' GRACE Cinnta Roll-On Liquid,₹315,₹239,75 ml,5,(3),24% off,Bank Offer
POY SIAN BRAND Pim-saen Balm Oil Refresh Inhalant Gel T...,₹599,₹246,3 x 8 ml,4.5,(11),58% off,Bank Offer
MY Dr. Pain Relief Cream 30 gm - Relieves Back Pain & J...,₹95,₹76,30 g,4.2,(68),20% off,Bank Offer
Orthomol Ayurvedic Ointment Gel for Pain Relief - 30 gm...,₹95,₹72,30 g,0,0,24% off,Bank Offer
"Dr. Ortho Pain Relief (Oil, Cap, Spray & Ointment) Liqu...",₹721,₹549,4 x 1,4.1,"(1,859)",23% off,Bank Offer
Eazybits Gopal Herbals Pain Nil Powder (60 sachets) Pow...,₹899,₹399,60 x 1 Units,4.3,(48),55% off,Bank Offer
homeobuy Wheezal's Mixture Cough and Expectorant (450 m...,₹245,₹185,450 ml,4.5,(4),24% off,Bank Offer
SCORTIS HEALTH CARE Volitis Pain Relief Balm Gel Strong...,₹525,₹399,11 x 40.91 g,0,0,24% off,"Buy 3 items, save extra 5%"
Eazybits Orthonil Ortho pai Nil Powder Joint Pain Relie...,"₹1,399",₹598,70 x 1 Units,4.3,(73),57% off,Bank Offer
Nurament Oil AYURVEDIC PAIN RELIEF OIL 50ML(PACK OF 2) ...,₹200,₹119,2 x 50 ml,3.9,(54),40% off,Bank Offer
Menthodex Pain Balm Balm,₹599,₹455,3 x 100 g,4.3,(116),24% off,Bank Offer
Orthayu Vediva Joints Pain ayurvedic solution Balm,"₹1,990","₹1,590",2 x 100.5 g,0,0,20% off,Bank Offer
COSIFY Schwabe- Essentia_Aurea- Gold Drops - Set of 2 B...,₹370,₹292,2 x 30 ml,0,0,21% off,Bank Offer
Dr. Ortho AYURVEDIC JOINT PAIN MASSAGE Oil (Pack of 1) ...,₹295,₹224,120 ml,4.2,(725),24% off,Bank Offer
Dr. Ortho Ayurvedic Joint Pain Massage Oil Liquid Pack ...,₹590,₹459,2 x 120 ml,4.3,"(5,718)",22% off,Bank Offer
VEDICINE Ashwagandha Powder 100 grams (Withania somnife...,₹299,₹171,150 g,4.2,(14),42% off,"Buy 3 items, save extra 5%"
EENUS sawczsxc sfgf 100% Original Hammer Of Thor Oil Pa...,₹999,₹599,30 ml,0,0,40% off,Bank Offer
Dr. Ortho Joint Pain Relief Oil 120ml - Ayurvedic Joint...,₹295,₹224,120 ml,4.2,"(29,251)",24% off,Bank Offer
Dr. Ortho Joint Pain Relief Ayurvedic Oil 120ml Liquid,₹295,₹224,120 ml,4.3,"(1,223)",24% off,Bank Offer
Herbal Magic 100% Natural Ashwagandha Safed Musli Shata...,"₹1,000",₹544,5 x 100 g,3.5,(15),45% off,"Buy 3 items, save extra 5%"
Dr. Ortho Joint Pain Relief Liquid (120ml With Balm 9gm...,₹330,₹256,2 x 64.5 g,5,(3),22% off,Bank Offer
Dr. Ortho PAIN RELIEF AYURVEDIC MEDICINE WITH CAPSULE A...,₹661,₹554,120 ml,4.5,(6),16% off,Bank Offer
HAPDCO RHEUMACON PAIN RELIEF OIL_4 60ml each (Pack of 4...,₹690,₹515,4 x 60 ml,5,(3),25% off,Bank Offer
"Eazybits New Ortho Power Tablet, For Joint Pain,(6 x 40...",₹999,₹549,6 x 40 Units,4.8,(9),45% off,Bank Offer
Eazybits Ortho Nil Powder Babaji Herbals 70pc Powder,"₹1,499",₹598,70 x 1 Units,4.2,(11),60% off,Bank Offer
Rahat Rooh Sukoon Ayurvedic Pain Relief Massage Oil 500...,₹560,₹455,500 ml,3.6,(13),18% off,Bank Offer
Kesri Tailam Strong & Effective 100 ml (Pack of 1) Liqu...,₹280,₹224,100 ml,0,0,20% off,Bank Offer
"Eazybits Chanda Ayurvedic Pharmacy, Chanda Goli, Chanda...",₹888,₹399,4 x 40 Units,0,0,55% off,Bank Offer
Eazybits 14 sachets Gopal Herbals Pain Nil Powder Powde...,₹499,₹157,14 x 1 Patches,3.7,(15),68% off,Bank Offer
"healofy Naturals Head & Neck Pain Relief Cream, (50gm) ...",₹499,₹391,50 g,5,(3),21% off,Bank Offer
Laam Ayurvedic Pain Relief Oil (Dard Niwarak Tel) 200 m...,₹180,₹136,200 ml,4.1,(20),24% off,Bank Offer
Noorani Tel PAIN RELIEF OIL 2000ML (PACK OF 1) Liquid,₹200,₹135,200 ml,4.2,(371),32% off,Bank Offer
Mediwrap Belladonna Pain Relief Plaster (Pack of 10) Pl...,₹160,₹124,10 x 1 Patches,4,(166),22% off,Bank Offer
Eazybits 42 sachets Gopal Herbals Pain Nil Powder Powde...,₹899,₹319,42 x 1 Units,4,(21),64% off,Bank Offer
"MY Dr. Pain Relief Oil (60 ml) , Cream (60 g) Combo Pac...",₹328,₹228,120 g,4.4,(89),30% off,Bank Offer
JointFlex Immediate & Long-Lasting Pain Relief and Heal...,₹590,₹374,2 x 120 ml,4.1,(518),36% off,Bank Offer
ARAMINTA MEDI ENTERPRISE Arch Support Socks Sleeves Pad...,₹999,₹227,2 x 75 g,0,0,77% off,Bank Offer
Eazybits Gopal Herbals Pain Nil Powder (60 sachets) Pow...,₹899,₹399,60 x 1 Units,4.3,(48),55% off,Bank Offer
Eazybits Orthonil Ortho pai Nil Powder Joint Pain Relie...,"₹1,399",₹598,70 x 1 Units,4.3,(73),57% off,Bank Offer
AKISON 14 Pouches ARTHO VEDA Powder arthoveda orthoveda...,₹299,₹159,14 x 1 Units,0,0,46% off,Bank Offer
IMC Pain away Oil Liquid Liquid,₹158,₹104,50 ml,4.3,(124),34% off,Bank Offer
Sandhi Sudha Body Pain Relief Liquid,"₹1,155","₹1,047",3 x 150 ml,4.1,(38),9% off,Bank Offer
PiloSpray Piles & Fissure Care Spray - 35 g pack of 2 (...,₹460,₹350,2 x 35 g,3.9,(220),23% off,Bank Offer
DEEMARK Ortho Pain Relief Balm,₹160,₹120,100 ml,3.9,(533),25% off,Bank Offer
"Dr. Ortho Pain Relief (Oil, Cap, Spray & Ointment) Liqu...",₹721,₹549,4 x 1,4.1,"(1,858)",23% off,Bank Offer
Basic Ayurveda Ayurh Syrup 450 Ml + Jod Bejod Oil 100 M...,₹780,₹675,3 Units,0,0,13% off,Bank Offer
ZANDU Rhumasyl Liniment (Pack of 2) Liquid,₹440,₹319,2 x 100 ml,4.2,(117),27% off,Bank Offer
Eazybits Ayurvedic Ortho Power Tablet (6 x 40 Units) Ta...,"₹1,299",₹549,6 x 40 Units,4.6,(7),57% off,Bank Offer
Dr. Ortho Ayurvedic Joint Pain Massage Oil Liquid Pack ...,₹590,₹459,2 x 120 ml,4.3,"(5,718)",22% off,Bank Offer
Eazybits Artho veda Powder Joint Pain Relief Powder (pa...,₹799,₹391,40 x 1 Units,4.1,(10),51% off,Bank Offer
homeobuy Wheezal's Mixture Cough and Expectorant 450 ml...,₹450,₹341,2 x 450 ml,0,0,24% off,Bank Offer
Himalaya Herbals Pain Relief Oil Pack Of 2 (200 ml) Liq...,₹220,₹164,2 x 50 ml,4.2,(264),25% off,Bank Offer
Azani Ice Balm Instant Pain Relief Cream for Men & Wome...,₹349,₹136,50 g,4.1,(70),61% off,Bank Offer
Dr. Ortho AYURVEDIC JOINT PAIN MASSAGE Oil (Pack of 1) ...,₹295,₹224,120 ml,4.2,(725),24% off,Bank Offer
"Dr. Ortho Pain Relief (120ml Oil, 30 Capsule, 75ml Spra...",₹721,₹549,4 x 1,4.1,(190),23% off,Bank Offer
Moo Tong Liniment oil 60ml Pack of 1 Made in singapore ...,"₹1,499",₹481,60 ml,4.7,(17),67% off,Bank Offer
Eazybits New Ortho Power Tablets (40 Tabs) Tablets,₹399,₹159,40 Units,0,0,60% off,Bank Offer
Dr. Ortho Joint Pain Relief Oil 120ml - Ayurvedic Joint...,₹295,₹224,120 ml,4.2,"(29,208)",24% off,Bank Offer
Dr. Ortho Joint Pain Relief Ayurvedic Oil 120ml Liquid,₹295,₹224,120 ml,4.2,"(1,212)",24% off,Bank Offer
Axe Brand Universal Oil #IMPORTED Liquid,₹320,₹185,10 ml,4.2,(156),42% off,Bank Offer
COSIFY Allen Genforte Male Tonic Syrup ( Male Relief To...,₹350,₹280,2 x 200 ml,0,0,20% off,Bank Offer
Asclepius Wellness Orthodoc Ras Liquid,"₹2,299","₹1,175",100 ml,4,(61),48% off,Lowest price in the year
Amrutanjan FASTER RELAXATION ROLL ON 10ML (Each) PACK O...,₹340,₹247,4 x 10 ml,4.5,(829),27% off,Bank Offer
Kwik Pain Relieving Oil for Joint Pain Liquid,₹283,₹159,120 ml,4.2,"(1,983)",43% off,Bank Offer
"Eazybits New Ortho Power Tablet, For Joint Pain,(6 x 40...",₹999,₹549,6 x 40 Units,4.8,(9),45% off,Bank Offer
JIVA Pain Relief Combo - Pain Calm Oil (200 ml) & Pain ...,₹499,₹359,3 x 66.67 ml,4.4,(5),28% off,Bank Offer
Eazybits Dard mukti powder-42 pieces Powder,₹799,₹359,42 x 1 Units,4.3,(7),55% off,Bank Offer
"MY Dr. Pain Relief Oil (60 ml) , Cream (60 g) Combo Pac...",₹328,₹228,120 g,4.4,(89),30% off,Bank Offer
Eazybits Ortho Nil Powder Babaji Herbals 70pc Powder,"₹1,499",₹598,70 x 1 Units,4.2,(11),60% off,Bank Offer
"Eazybits gopal herbal joint relief powder ,for joint pa...",₹499,₹191,21 x 1 Units,5,(4),61% off,Bank Offer
YAJNAS Sri Ratna 100 ml (Pack of 5) Ayurvedic / Natural...,"₹2,995",₹498,5 x 100 ml,0,0,83% off,Bank Offer
"Kwik Pain Relieving Oil for Joint Pain (120ml, Pack of ...","₹1,132",₹696,4 x 120 ml,3.8,(12),38% off,Bank Offer
Herbal Tantra Natural Pain Relief Roll On Liquid,₹399,₹142,10 ml,0,0,64% off,Bank Offer
"Eazybits Chanda Ayurvedic Pharmacy, Chanda Goli, Chanda...",₹888,₹399,4 x 40 Units,0,0,55% off,Bank Offer
