MedicineName,Old price,NewPrice,Quantity,Stars,Rating,Discount,Description
Dabur Shilajit,₹255,₹172,0,3.6,"(9,236)",32% off,"Buy 3 items, save extra 5%"
Galact Granules - Breast Feeding Supplement – Increase ...,₹383,₹276,0,4.4,"(1,374)",27% off,Bank Offer
Dettol Effective Protection Antiseptic Liquid,₹364,₹250,1000 ml,4.6,"(31,127)",31% off,"Buy 3 items, save extra 5%"
"Dettol Antiseptic Disinfectant liquid for First aid, Su...",₹642,₹452,"550 ml, Pack of 3",4.6,"(1,452)",29% off,"Buy 3 items, save extra 5%"
Dabur Chyawanprash,₹249,₹167,0,4.5,"(79,021)",32% off,"Buy 3 items, save extra 5%"
Dettol Effective Protection Antiseptic Liquid,₹214,₹147,550 ml,4.5,"(5,651)",31% off,"Buy 3 items, save extra 5%"
Baidyanath Vansaar Isabgol - Psyllium Husk Powder - 100...,₹120,₹69,0,4.4,"(5,226)",42% off,"Buy 3 items, save extra 5%"
HIMALAYA Guduchi,₹165,₹92,0,4.4,"(2,068)",44% off,"Buy 3 items, save extra 5%"
"MOOV Instant Pain Relief Cream Regular - 50 gm, Pack of...",₹557,₹356,3 x 50 g,4.5,"(3,568)",36% off,"Buy 3 items, save extra 5%"
Dabur Chyawanprakash,₹415,₹280,900 g,4.5,"(15,180)",32% off,"Buy 3 items, save extra 5%"
HIMALAYA Gokshura,₹165,₹116,0,4.2,"(25,712)",29% off,"Buy 3 items, save extra 5%"
HIMALAYA Neem,₹165,₹116,0,4.3,"(7,256)",29% off,"Buy 3 items, save extra 5%"
"Dettol Antiseptic Disinfectant liquid for First aid, Su...",₹428,₹294,"1100 ml, Pack of 2",4.5,"(6,649)",31% off,"Buy 3 items, save extra 5%"
"Dettol Surface Disinfection 1.5L Kit - Lavender, Lime, ...",₹579,₹277,"1500 ml, Pack of 3",4.4,(170),52% off,Bank Offer
Kapiva Get Slim Juice | Helps Burn Fat Naturally | Good...,₹549,₹421,0,4,"(15,094)",23% off,"Buy 3 items, save extra 5%"
ZANDU Chyavanprashad,₹440,₹240,900 g,4.3,"(5,328)",45% off,"Buy 3 items, save extra 5%"
Waterbury's Compound A-Provides Quick Relief from Cold ...,₹444,₹225,Pack of 3,4.4,(114),49% off,Bank Offer
Dr. Vaidya's Piles care - Ayurvedic Capsules fast Relie...,₹600,₹353,Pack of 2,3.8,"(2,528)",41% off,Bank Offer
sanyasi ayurveda Sanyasi Sehat Tablet - Ayurvedic Medic...,₹699,₹599,0,4.1,"(19,742)",14% off,Bank Offer
Dettol Disinfectant Lime Fresh Antiseptic Liquid,₹193,₹115,500 ml,4.4,"(11,811)",40% off,"Buy 3 items, save extra 5%"
"Sensur Natural & Ayurvedic Pain Relief Rub -(30mg, Pack...",₹421,₹159,3 x 30 g,4.5,(74),62% off,Bank Offer
Dabur Chyawanprakash Sugarfree,₹235,₹168,0,4.4,"(7,292)",28% off,"Buy 3 items, save extra 5%"
Dabur Chyawanprash Awaleha,0,₹395,0,4.5,"(56,430)",0,Bank Offer
RAJASTHAN HERBALS PAIN NIWARAN CHURNA [AYURVEDIC] (135 ...,₹580,₹245,0,4.3,"(4,625)",57% off,"Buy 3 items, save extra 5%"
ZANDU Chyavanprash Avaleha Jaggery,₹345,₹207,900 g,4.3,(219),40% off,Bank Offer
"Dettol Disinfectant Multi-Use Hygiene Liquid, Menthol C...",₹579,₹347,"1500 ml, Pack of 3",4.5,"(12,066)",40% off,"Buy 3 items, save extra 5%"
Kapiva Aloe Vera + Garcinia Juice Aids Weight Loss - No...,₹550,₹303,0,4.3,"(23,873)",44% off,"Buy 3 items, save extra 5%"
Dr. Vaidya's Herboslim - Ayurvedic and Natural Treatmen...,₹500,₹295,Pack of 2,3.8,(334),41% off,Bank Offer
AIMIL BGR-34 tablets | Carbohydrate metaboliser,₹600,₹320,0,4.3,"(2,688)",46% off,"Buy 3 items, save extra 5%"
Dettol Disinfectant Menthol Cool Antiseptic Liquid,₹193,₹100,500 ml,4.4,"(12,872)",48% off,"Buy 3 items, save extra 5%"
Gynoveda Medohar Guggulu Fat Burner Ayurvedic Tablets F...,"₹1,400",₹782,0,4,(71),44% off,"Buy 3 items, save extra 5%"
"Gynoveda Women 14+ Iron Folic Acid, Ayurvedic Blood Bui...",₹700,₹220,0,4.4,(224),68% off,Lowest price since launch
Kapiva Himalayan Shilajit Resin|Rich in Fulvic Acid|For...,"₹1,499",₹749,0,4.1,"(4,190)",50% off,"Buy 3 items, save extra 5%"
"Dettol Multipurpose Disinfectant liquid, Lime Fresh Ant...",₹347,₹193,1000 ml,4.4,"(25,133)",44% off,"Buy 3 items, save extra 5%"
Baidyanath Vansaar Isabgol - Psyllium Husk Powder - 200...,₹225,₹125,0,4.5,"(4,958)",44% off,"Buy 3 items, save extra 5%"
"MOOV Instant Pain Relief Spray - 50 g, Pack of 3 Spray",₹570,₹364,3 x 50 g,4.4,"(10,360)",36% off,"Buy 3 items, save extra 5%"
Gynoveda Women 16+ Skin Repair. AMLA Ayurvedic Tablets....,₹700,₹179,0,3.9,(40),74% off,"Buy 3 items, save extra 5%"
Dr. Vaidya's Herbobuild - Ayurvedic Capsules For Muscle...,₹299,₹119,0,4,"(23,701)",60% off,"Buy 3 items, save extra 5%"
Kapiva Get Slim Juice| Goodness of 12 Ayurvedic Herbs |...,"₹1,098",₹669,Pack of 2,4,"(15,127)",39% off,Bank Offer
ZANDU Kesari Jivan,₹420,₹302,0,4.4,"(7,224)",28% off,"Buy 3 items, save extra 5%"
Kapiva Hair Care Juice| For Hair Nourishment from Withi...,"₹1,398",₹753,Pack of 2,4.1,(810),46% off,Bank Offer
Kapiva Amla Juice Pack of 2 | Boosts Skin & Hair Health,₹598,₹339,Pack of 2,4.3,(86),43% off,"Buy 3 items, save extra 5%"
Riffway Porushbal Tablets Helps In Boosting The Energy ...,₹999,₹143,0,2.7,(3),85% off,"Buy 3 items, save extra 5%"
Dr Chopra Double Power Sanda Oil Pack of 3,₹975,₹151,Pack of 3,5,(6),84% off,Bank Offer
hervedic Bigjack Capsule Oil ling Men Medicine 1sex Mot...,"₹4,999","₹1,899",0,0,0,62% off,Bank Offer
inlazer Peni Flux Ayurvedic Supplement Improves Male En...,₹999,₹143,0,3.4,(16),85% off,"Buy 3 items, save extra 5%"
INSTANT VEDA Raw & Pure Shilajit Resin | with Iron | Hi...,"₹1,199",₹664,0,4,(239),44% off,Bank Offer
Gynoveda Women 16+ Skin Repair. AMLA Ayurvedic Tablets....,₹700,₹179,0,3.9,(40),74% off,"Buy 3 items, save extra 5%"
natural ayurveda Mardana taqat capsule for long time st...,"₹1,999",₹262,0,3.6,(21),86% off,Bank Offer
AIMIL BGR-34 tablets | Carbohydrate metaboliser,₹600,₹320,0,4.3,"(2,688)",46% off,"Buy 3 items, save extra 5%"
Kapiva Karela Jamun Juice | Natural Juice made from Fre...,₹349,₹184,0,4.3,"(3,924)",47% off,"Buy 3 items, save extra 5%"
Savlon Disinfectant Antiseptic Liquid,₹310,₹138,1 L,4.5,"(30,767)",55% off,"Buy 3 items, save extra 5%"
"Dettol Multipurpose Disinfectant liquid, Lime Fresh Ant...",₹347,₹193,1000 ml,4.4,"(25,133)",44% off,"Buy 3 items, save extra 5%"
Baidyanath Vansaar Isabgol - Psyllium Husk Powder - 200...,₹225,₹125,0,4.5,"(4,958)",44% off,"Buy 3 items, save extra 5%"
Dettol Disinfectant Menthol Cool Antiseptic Liquid,₹193,₹100,500 ml,4.4,"(12,872)",48% off,"Buy 3 items, save extra 5%"
Aqualens Comfort Contact Lens Cleaner (Lens Case Free) ...,₹240,₹140,120 ml,4.5,"(1,332)",41% off,"Buy 3 items, save extra 25%"
HIMALAYA Guduchi,₹165,₹92,0,4.4,"(2,068)",44% off,"Buy 3 items, save extra 5%"
Gynoveda Medohar Guggulu Fat Burner Ayurvedic Tablets F...,"₹1,400",₹782,0,4,(71),44% off,"Buy 3 items, save extra 5%"
7 Days Ayurvedic Power Massage Oil for Men,₹599,₹279,0,3.6,(69),53% off,Bank Offer
7Herbmaya 9 Inch Long Capsule with Increase Power Oil f...,₹795,₹234,Pack of 2,4.1,(14),70% off,Lowest price since launch
Kapiva Dia Free Juice - Controls Blood Sugar Levels | A...,₹549,₹355,0,4.3,"(1,764)",35% off,"Buy 3 items, save extra 5%"
Kapiva Pure Tulsi Ark (Helps Boost Immunity) - 30 Ml,₹320,₹168,0,4.4,(281),47% off,"Buy 3 items, save extra 5%"
SBL Nuphar Lutea Q Mother Tincture,₹300,₹200,30 ml,4.1,(70),33% off,Bank Offer
SBL Agnus Castus Q Mother Tincture,₹360,₹224,3 x 30 ml,4.3,(31),37% off,Bank Offer
69 Products Kama Stamina Power Capsule For Men 1sex Pow...,"₹2,800",₹549,0,3.3,(6),80% off,Bank Offer
"Dettol Disinfectant Multi-Use Hygiene Liquid, Menthol C...",₹579,₹347,"1500 ml, Pack of 3",4.5,"(12,086)",40% off,"Buy 3 items, save extra 5%"
Kapiva Aloe Vera + Wheatgrass Juice Natural Detoxifier ...,₹450,₹244,0,4.3,"(23,833)",45% off,"Buy 3 items, save extra 5%"
Gynoveda Anti Acne Ayurvedic Medicine. Manjistha Blood ...,₹800,₹483,0,4.1,(149),39% off,"Buy 3 items, save extra 5%"
Kapiva Get Slim Juice| Goodness of 12 Ayurvedic Herbs |...,"₹1,098",₹669,Pack of 2,4,"(15,094)",39% off,Bank Offer
ZANDU Kesari Jivan,₹420,₹302,0,4.4,"(7,231)",28% off,"Buy 3 items, save extra 5%"
Kapiva Digesti Care Juice - Provides Relief From Acidit...,₹549,₹307,0,4,(384),44% off,Bank Offer
Vansaar Shilajit Resin Performance Booster|15 gm ( from...,"₹1,499",₹724,0,4,(4),51% off,"Buy 3 items, save extra 5%"
Galact Granules - Breast Feeding Supplement – Increase ...,₹383,₹276,0,4.4,"(1,368)",27% off,Bank Offer
VITASTA Sunda oil mardo ka gupt malish tel 90 ml,"₹4,497",₹399,Pack of 3,4.5,(18),91% off,Bank Offer
"INTIMIFY Stamina & Power Massage Oil, Sanda Oil for Men...",₹599,₹199,0,4.3,(24),66% off,Bank Offer
"VITASTA Ayurvedic capsule for long time stamina,power,S...","₹1,199",₹304,0,4.8,(4),74% off,Bank Offer
Kapiva Rajasthani Neem Juice | Natural Juice made from ...,₹349,₹197,0,4.3,"(23,833)",43% off,"Buy 3 items, save extra 5%"
"Gynoveda Thyroid Ayurvedic Tablet, Kanchnar Guggulu Mai...","₹1,400",₹755,0,4.5,(151),46% off,Lowest price since launch
Riffway Deep Ride Ayurvedic Capsule Improves Endurance ...,₹999,₹136,0,0,0,86% off,"Buy 3 items, save extra 5%"
INTIMIFY sanda oil for panis growth sanda oil for men l...,₹599,₹200,0,3.2,(13),66% off,Bank Offer
Kapiva Hair Care Juice| For Hair Nourishment from Withi...,"₹1,398",₹753,Pack of 2,4.1,(810),46% off,Bank Offer
"Nirvasa Shilajit with Safed Mulsi For Strength, Power &...","₹1,299",₹323,0,4.3,(513),75% off,"Buy 3 items, save extra 5%"
"VITASTA Night power oil for Stamina,Power","₹2,697",₹434,Pack of 3,4.1,(83),83% off,Bank Offer
NUTRILEY Ayurvedic massage cream for men long time sexs...,₹499,₹368,0,0,0,26% off,Bank Offer
"VITASTA Ayurvedic Delay spray,long time,long last spray...","₹1,099",₹236,0,3.8,(65),78% off,Bank Offer
PATANJALI Youvnamrit Vati 40Tab,₹400,₹320,0,3.9,(64),20% off,Bank Offer
Kapiva Amla Juice Pack of 2 | Boosts Skin & Hair Health,₹598,₹339,Pack of 2,4.3,(86),43% off,"Buy 3 items, save extra 5%"
Gynoveda Women 16+ Skin Repair. AMLA Ayurvedic Tablets....,₹700,₹179,0,3.9,(40),74% off,"Buy 3 items, save extra 5%"
Dabur Dhatupaushtik Churana (100g) 1 Piece,₹245,₹196,0,4,(50),20% off,Bank Offer
BOROPLUS Healthy Skin Antiseptic Cream,₹280,₹183,"160 ml, Pack of 2",4.5,"(6,590)",34% off,Bank Offer
Kapiva Karela Jamun Juice | Natural Juice made from Fre...,₹349,₹184,0,4.3,"(3,924)",47% off,"Buy 3 items, save extra 5%"
Savlon Disinfectant Antiseptic Liquid,₹310,₹138,1 L,4.5,"(30,758)",55% off,"Buy 3 items, save extra 5%"
HIMALAYA Ashvagandha,₹180,₹140,0,4.2,"(63,624)",22% off,"Buy 3 items, save extra 5%"
"Dettol Multi-use Hygiene Liquid, Lime Fresh - 500 ml An...",₹386,₹231,"1000 ml, Pack of 2",4.4,"(19,958)",40% off,"Buy 3 items, save extra 5%"
Paurush Jiwan (Pack of 2),₹444,₹220,0,4.2,"(7,961)",50% off,"Buy 3 items, save extra 5%"
Aqualens Comfort Contact Lens Cleaner (Lens Case Free) ...,₹440,₹172,360 ml,4.5,(836),60% off,Saver Deal
HIMALAYA Guduchi,₹165,₹92,0,4.4,"(2,068)",44% off,"Buy 3 items, save extra 5%"
Gynoveda Medohar Guggulu Fat Burner Ayurvedic Tablets F...,"₹1,400",₹782,0,4,(71),44% off,"Buy 3 items, save extra 5%"
Fasczo Extreme Sex Oil Long Time | Sexual Oil Boosts Yo...,₹699,₹278,0,0,0,60% off,Bank Offer
inlazer His Force 1Sex Power Capsule Men Enjoy Sexual P...,₹999,₹199,0,0,0,80% off,Bank Offer
Kapiva Pure Tulsi Ark (Helps Boost Immunity) - 30 Ml,₹320,₹168,0,4.4,(281),47% off,"Buy 3 items, save extra 5%"
Kapiva Dia Free Juice - Controls Blood Sugar Levels | A...,₹549,₹355,0,4.3,"(1,764)",35% off,"Buy 3 items, save extra 5%"
Fasczo Golden Jack Organic Solution Removes Weakness Of...,"₹1,999",₹215,Pack of 2,0,0,89% off,"Buy 3 items, save extra 5%"
"VITASTA Josh Plus Ayurvedic Massage Oil For Long,Time, ...","₹1,199",₹203,0,0,0,83% off,Bank Offer
ELEMENTS WELLNESS WOMAN COMPANION PACK OF 2 400 ML,₹680,₹376,Pack of 2,4.3,(46),44% off,Bank Offer
MOOV Instant Pain Relief Spray Spray,₹290,₹208,80 g,4.4,"(10,321)",28% off,"Buy 3 items, save extra 5%"
Kapiva Aloe Vera + Wheatgrass Juice Natural Detoxifier ...,₹450,₹244,0,4.3,"(23,833)",45% off,"Buy 3 items, save extra 5%"
Gynoveda Anti Acne Ayurvedic Medicine. Manjistha Blood ...,₹800,₹483,0,4.1,(149),39% off,"Buy 3 items, save extra 5%"
Dettol Antiseptic Liquid for First Aid & Liquid Disinfe...,₹711,₹611,"1 L, Pack of 2",0,0,14% off,Bank Offer
AIMIL Lukoskin Oral Liquid - 100 ml,₹610,₹429,0,4.2,"(1,413)",29% off,"Buy 3 items, save extra 5%"
Kapiva Digesti Care Juice - Provides Relief From Acidit...,₹549,₹307,0,4,(384),44% off,Bank Offer
Vansaar Shilajit Resin Performance Booster|15 gm ( from...,"₹1,499",₹724,0,4,(4),51% off,"Buy 3 items, save extra 5%"
Dettol Antiseptic Liquid for First Aid & Liquid Disinfe...,₹711,₹611,"1 L, Pack of 2",0,0,14% off,Bank Offer
HIMALAYA Brahmi,₹165,₹116,0,4.3,"(7,504)",29% off,"Buy 3 items, save extra 5%"
INTIMIFY Ayurvedic sanda Oil ling massage Oil For Men,₹599,₹204,0,4,(62),65% off,Bank Offer
"N2B AYURVEDA Sanda Extra Power Oil 30ml for men, aroma ...","₹1,199",₹158,0,4.7,(6),86% off,Bank Offer
Kapiva Rajasthani Neem Juice | Natural Juice made from ...,₹349,₹197,0,4.3,"(23,833)",43% off,"Buy 3 items, save extra 5%"
"Gynoveda Thyroid Ayurvedic Tablet, Kanchnar Guggulu Mai...","₹1,400",₹755,0,4.5,(153),46% off,Lowest price since launch
INTIMIFY Power Oil for Men 1sex Power Male Long Time Pe...,₹699,₹229,0,0,0,67% off,Bank Offer
"VITASTA Ayurvedic massage oil,Sanda oil,japani oil","₹4,497",₹451,Pack of 3,0,0,89% off,Bank Offer
Kapiva Hair Care Juice| For Hair Nourishment from Withi...,"₹1,398",₹753,Pack of 2,4.1,(810),46% off,Bank Offer
"Nirvasa Shilajit with Safed Mulsi For Strength, Power &...","₹1,299",₹323,0,4.3,(513),75% off,"Buy 3 items, save extra 5%"
Inzylus Sexual Power Medicine | Sexual Power Medicine |...,₹999,₹239,0,3.9,(8),76% off,Bank Offer
inlazer Vigorous Male _ Capsule Sex Products Bigger Har...,₹999,₹240,0,0,0,75% off,Bank Offer
"VITASTA Long,Time,Ayurvedic Massage oil XXXL,Power,for ...","₹1,299",₹236,0,3.4,(5),81% off,Bank Offer
inlazer Max Night Sex Pills Men's Sexual Energetic Powe...,₹999,₹238,0,0,0,76% off,Bank Offer
Kapiva Amla Juice Pack of 2 | Boosts Skin & Hair Health,₹598,₹339,Pack of 2,4.3,(86),43% off,"Buy 3 items, save extra 5%"
Gynoveda Women 16+ Skin Repair. AMLA Ayurvedic Tablets....,₹700,₹179,0,3.9,(40),74% off,"Buy 3 items, save extra 5%"
Vigini Long Time Increase Strength Stamina Big Size Pow...,₹825,₹359,0,4.2,(18),56% off,Bank Offer
"Dettol Home Disinfection Pack - Lavender, Lime (500ml e...",₹545,₹261,"1225 ml, Pack of 3",4.5,(105),52% off,"Buy 3 items, save extra 5%"
Savlon Disinfectant Antiseptic Liquid,₹310,₹138,1 L,4.5,"(30,758)",55% off,"Buy 3 items, save extra 5%"
HIMALAYA Guduchi,₹165,₹92,0,4.4,"(2,068)",44% off,"Buy 3 items, save extra 5%"
Kapiva Karela Jamun Juice | Natural Juice made from Fre...,₹349,₹184,0,4.3,"(3,924)",47% off,"Buy 3 items, save extra 5%"
Kapiva Thar Aloe Vera Juice (with Pulp) | Rejuvenates S...,₹299,₹145,0,4.3,"(23,873)",51% off,"Buy 3 items, save extra 5%"
AMBIC Nav Nirman DS Tablet I Ayurvedic Weight Gain Tabl...,₹138,₹94,0,4.1,"(1,435)",31% off,"Buy 3 items, save extra 5%"
SBL ClearStone Drops,₹465,₹286,3 x 30,4.3,(575),38% off,Bank Offer
Gynoveda Medohar Guggulu Fat Burner Ayurvedic Tablets F...,"₹1,400",₹782,0,4,(71),44% off,"Buy 3 items, save extra 5%"
Kapiva Pure Tulsi Ark (Helps Boost Immunity) - 30 Ml,₹320,₹168,0,4.4,(281),47% off,"Buy 3 items, save extra 5%"
Rex Remedies Farbah Oil (50ml),₹430,₹293,0,3.8,(27),31% off,Bank Offer
Good Health Dr chopra natural aroma sanda oil massage d...,₹975,₹180,Pack of 3,3.5,(13),81% off,Bank Offer
Kapiva Acne Ease Juice - Ayurvedic Juice for Acne Contr...,₹549,₹280,0,4.2,(207),48% off,Bank Offer
Kapiva Aloe Vera + Wheatgrass Juice Natural Detoxifier ...,₹450,₹244,0,4.3,"(23,873)",45% off,"Buy 3 items, save extra 5%"
Riffway Peni Flux Herbal Wellness Intensifies Male Orga...,₹999,₹179,0,0,0,82% off,"Buy 3 items, save extra 5%"
Dr Chopra Musli Blast Power Capsule 30,₹850,₹155,0,4.7,(3),81% off,Bank Offer
Riffway Golden Jack Organic Tablet Makes Orgasm Powerfu...,₹999,₹136,0,0,0,86% off,"Buy 3 items, save extra 5%"
ZANDU Ortho Vedic Oil 100ml + 20% Extra Liquid,₹295,₹157,120 ml,4.2,"(1,231)",46% off,"Buy 3 items, save extra 5%"
Gynoveda Anti Acne Ayurvedic Medicine. Manjistha Blood ...,₹800,₹483,0,4.1,(149),39% off,"Buy 3 items, save extra 5%"
Kapiva Digesti Care Juice - Provides Relief From Acidit...,₹549,₹307,0,4,(384),44% off,Bank Offer
Rajasthan Herbals International Namira Weight Gain Chur...,₹900,₹374,0,4.1,"(1,958)",58% off,"Buy 3 items, save extra 5%"
"Dettol Disinfectant Multi-Use Hygiene Liquid, Menthol C...",₹386,₹216,"1000 ml, Pack of 2",4.5,"(12,066)",44% off,"Buy 3 items, save extra 5%"
Vansaar Shilajit Resin Performance Booster|15 gm ( from...,"₹1,499",₹724,0,4,(4),51% off,"Buy 3 items, save extra 5%"
Kapiva Rajasthani Neem Juice | Natural Juice made from ...,₹349,₹197,0,4.3,"(23,873)",43% off,"Buy 3 items, save extra 5%"
MOOV Instant Pain Relief Spray Spray,₹199,₹151,50 g,4.4,"(10,370)",24% off,"Buy 3 items, save extra 5%"
HIMALAYA Brahmi,₹165,₹116,0,4.3,"(7,504)",29% off,"Buy 3 items, save extra 5%"
"VITASTA Josh Plus Ayurvedic Capsule for Long,Time,Stami...","₹1,999",₹271,0,0,0,86% off,Bank Offer
Bjain Caladium Seguinum 1000 CH Dilution,₹190,₹135,2 x 12 ml,3.8,(15),28% off,Bank Offer
"Gynoveda Thyroid Ayurvedic Tablet, Kanchnar Guggulu Mai...","₹1,400",₹755,0,4.5,(153),46% off,Lowest price since launch
Gynoveda Vitamin B12 Ayurvedic Capsules (30) | Brain & ...,₹499,₹243,0,4.3,(8),51% off,"Buy 3 items, save extra 5%"
"Viniiglow Botanics Fat Burner Fat Burning Oil,fat go, f...",₹499,₹188,0,4.2,(5),62% off,Bank Offer
Riffway Golden Jack Herbal Pills Makes Orgasm Powerful ...,₹999,₹136,0,0,0,86% off,"Buy 3 items, save extra 5%"
Kapiva Hair Care Juice| For Hair Nourishment from Withi...,"₹1,398",₹753,Pack of 2,4.1,(810),46% off,Bank Offer
"Nirvasa Shilajit with Safed Mulsi For Strength, Power &...","₹1,299",₹323,0,4.3,(516),75% off,"Buy 3 items, save extra 5%"
Make Unique Level X Extra Gold Power Health Capsules Fo...,"₹2,499",₹799,0,0,0,68% off,Bank Offer
"Viniiglow Botanics Organic Fat Burner Fat Burning Oil, ...",₹499,₹196,0,0,0,60% off,Bank Offer
AWROK Power Gen Sanda Ayurvedic Men's X Power Aroma Mas...,₹999,₹439,0,3.3,(11),56% off,Bank Offer
Ooplore Titan Gold Gel,"₹2,290",₹849,0,0,0,62% off,Bank Offer
Kapiva Amla Juice Pack of 2 | Boosts Skin & Hair Health,₹598,₹339,Pack of 2,4.3,(86),43% off,"Buy 3 items, save extra 5%"
Gynoveda Women 16+ Skin Repair. AMLA Ayurvedic Tablets....,₹700,₹179,0,3.9,(40),74% off,"Buy 3 items, save extra 5%"
INTIMIFY Herbal Oil Japani 1sex Power Men Booster Big P...,₹599,₹210,0,3.6,(15),64% off,Bank Offer
Kapiva Triphala Juice | Ayurvedic Formula Acts as Herba...,₹299,₹172,0,4.3,"(23,873)",42% off,"Buy 3 items, save extra 5%"
Kapiva Karela Jamun Juice | Natural Juice made from Fre...,₹349,₹184,0,4.3,"(3,924)",47% off,"Buy 3 items, save extra 5%"
Savlon Disinfectant Antiseptic Liquid,₹310,₹138,1 L,4.5,"(30,767)",55% off,"Buy 3 items, save extra 5%"
Kapiva Rose Skin Rituals | Skin Foods Glow Mix + Rose W...,"₹1,598",₹539,0,4.1,(24),66% off,"Buy 3 items, save extra 5%"
Nua Cramp Comfort || Pack of 3 Heat Patches for Period ...,₹339,₹201,3 x 1 Patches,4.3,"(1,587)",40% off,Bank Offer
ARISH BIO-NATURAL Haldi neem antiseptic Antiseptic Crea...,₹250,₹180,50 ml,4.5,"(1,795)",28% off,Bank Offer
"INTIMIFY Beard oil advanced for men fast growth, Mousta...",₹599,₹146,0,4.4,(84),75% off,Bank Offer
HIMALAYA Guduchi,₹165,₹92,0,4.4,"(2,068)",44% off,"Buy 3 items, save extra 5%"
Gynoveda Medohar Guggulu Fat Burner Ayurvedic Tablets F...,"₹1,400",₹782,0,4,(71),44% off,"Buy 3 items, save extra 5%"
"Riffway Big Disk Tablets For Energy, Stamina & Muscle G...",₹999,₹143,0,3,(4),85% off,"Buy 3 items, save extra 5%"
VITASTA VIGOR SHILAJIT 30 CAPSULES,"₹1,399",₹304,0,3.8,(9),78% off,Bank Offer
Kapiva Pure Tulsi Ark (Helps Boost Immunity) - 30 Ml,₹320,₹168,0,4.4,(281),47% off,"Buy 3 items, save extra 5%"
Kapiva Dia Free Juice - Controls Blood Sugar Levels | A...,₹549,₹355,0,4.3,"(1,764)",35% off,"Buy 3 items, save extra 5%"
Geo Herb Shan E Mard Majoon Special 125gms,₹370,₹255,0,4.4,(31),31% off,Bank Offer
Fasczo Wellness Sex Oil Long Time | Sexual Oil Boosts Y...,₹699,₹278,0,0,0,60% off,Bank Offer
"RWHC Sanda Ayurvedic Ling Mota Lamba Ling Oil 8 Inch, L...","₹1,999",₹899,0,4,(4),55% off,Bank Offer
Dabur Chyawanprash -1.5 kg,₹535,₹385,0,4.4,"(1,229)",28% off,"Buy 3 items, save extra 5%"
Kapiva Aloe Vera + Wheatgrass Juice Natural Detoxifier ...,₹450,₹244,0,4.3,"(23,873)",45% off,"Buy 3 items, save extra 5%"
Gynoveda Anti Acne Ayurvedic Medicine. Manjistha Blood ...,₹800,₹483,0,4.1,(149),39% off,"Buy 3 items, save extra 5%"
Baidyanath Sugarfree Chyawan Vit formulated Chyawanpras...,₹221,₹114,0,4.2,"(1,504)",48% off,"Buy 3 items, save extra 5%"
VEDIVA Growth On Powder for perfect height,"₹2,000","₹1,590",Pack of 2,3.6,(42),20% off,Bank Offer
Kapiva Digesti Care Juice - Provides Relief From Acidit...,₹549,₹307,0,4,(382),44% off,Bank Offer
Vansaar Shilajit Resin Performance Booster|15 gm ( from...,"₹1,499",₹724,0,4,(4),51% off,"Buy 3 items, save extra 5%"
Gynoveda Haridra Khanda Anti Pigmentation Ayurvedic Tab...,₹900,₹534,0,4.1,(395),40% off,"Buy 3 items, save extra 5%"
DR Relaxi RAJASTHAN HERBALS CAPSULES (AYURVEDIC) FOR JO...,₹390,₹286,0,4.3,"(1,348)",26% off,Bank Offer
"7 Days Sanda oil for man, for long drive aroma massage ...",₹599,₹279,0,0,0,53% off,Bank Offer
"wvhc Ayurvedic sanda sexual power oil , gel Japanilong ...",₹999,₹430,0,4.5,(14),56% off,Bank Offer
Kapiva Rajasthani Neem Juice | Natural Juice made from ...,₹349,₹197,0,4.3,"(23,873)",43% off,"Buy 3 items, save extra 5%"
"Gynoveda Thyroid Ayurvedic Tablet, Kanchnar Guggulu Mai...","₹1,400",₹755,0,4.5,(151),46% off,Lowest price since launch
Fasczo Extreme Sex Oil Long Time | Sexual Oil Boosts Yo...,₹699,₹278,0,0,0,60% off,Bank Offer
Dr Chopra DR Chopra kama-Sutra Extra Gold 60 Capsule,"₹2,500",₹308,0,2.8,(6),87% off,Bank Offer
Kapiva Hair Care Juice| For Hair Nourishment from Withi...,"₹1,398",₹753,Pack of 2,4.1,(810),46% off,Bank Offer
Kapiva Amla Juice Pack of 2 | Boosts Skin & Hair Health,₹598,₹339,Pack of 2,4.3,(86),43% off,"Buy 3 items, save extra 5%"
Vadit organics Power gen xtra oil to boost Sex TIMING/S...,₹750,₹184,0,0,0,75% off,Bank Offer
Vadit organics Performance Booster Oil in Night Act 100...,₹499,₹221,0,4,(3),55% off,Bank Offer
69 Products Ayuvedic Japani Double Power Capsules For M...,"₹3,000","₹1,249",0,0,0,58% off,Bank Offer
New Shama WAJID ALI SHAH TILA,₹225,₹180,0,3.9,(85),20% off,Bank Offer
Gynoveda Women 16+ Skin Repair. AMLA Ayurvedic Tablets....,₹700,₹179,0,3.9,(40),74% off,"Buy 3 items, save extra 5%"
Kapiva Karela Jamun Juice | Natural Juice made from Fre...,₹349,₹184,0,4.3,"(3,924)",47% off,"Buy 3 items, save extra 5%"
Namyaa Anartava -For Delayed and Irregular Periods 500m...,₹240,₹168,0,4.1,"(5,920)",30% off,Bank Offer
"INSTANT VEDA Ashwagandha Capsules | For Men, Women & Te...",₹599,₹301,0,4.1,"(1,363)",49% off,Bank Offer
Savlon Disinfectant Antiseptic Liquid,₹310,₹138,1 L,4.5,"(30,758)",55% off,"Buy 3 items, save extra 5%"
HIMALAYA Guduchi,₹165,₹92,0,4.4,"(2,068)",44% off,"Buy 3 items, save extra 5%"
"Kapiva Ashwagandha Gold Capsules |With Gold, Shilajit |...",₹499,₹255,0,4.2,(132),48% off,"Buy 3 items, save extra 5%"
"Dettol Liquid Disinfectant for Floor Cleaner,Lavender B...",₹193,₹115,500 ml,4.2,"(2,384)",40% off,"Buy 3 items, save extra 5%"
Gynoveda Anti Acne Ayurvedic Medicine. Manjistha Blood ...,₹800,₹483,0,4.1,(149),39% off,"Buy 3 items, save extra 5%"
hervedic Bigjack Ayurvedic Massage Power Oil for Men,"₹2,699",₹649,0,0,0,75% off,Bank Offer
Gynoveda Medohar Guggulu Fat Burner Ayurvedic Tablets F...,"₹1,400",₹782,0,4,(71),44% off,"Buy 3 items, save extra 5%"
Kapiva Pure Tulsi Ark (Helps Boost Immunity) - 30 Ml,₹320,₹168,0,4.4,(281),47% off,"Buy 3 items, save extra 5%"
natural ayurveda Sanda Ayurvedic Oil for strength and s...,"₹1,299",₹100,0,0,0,92% off,Bank Offer
"VITASTA Josh Plus Oil for Long,Time,Stamina,Power","₹2,598",₹372,Pack of 2,0,0,85% off,Bank Offer
Kapiva Acne Ease Juice - Ayurvedic Juice for Acne Contr...,₹549,₹280,0,4.2,(207),48% off,Bank Offer
Kapiva Dia Free Juice - Controls Blood Sugar Levels | A...,₹549,₹355,0,4.3,"(1,764)",35% off,"Buy 3 items, save extra 5%"
Dr Chopra Double Power Sanda Oil Pack of 2,₹650,₹96,Pack of 2,3.4,(517),85% off,Bank Offer
inlazer Manhardy Sex Tablet Men's Sexual Energetic Powe...,₹999,₹238,0,0,0,76% off,Bank Offer
Jickosm JM0211 Good Health Capsule To Improve Digestive...,₹232,₹168,0,4.4,(79),27% off,Bank Offer
HIMALAYA Ashvagandha General Wellness Tablet Pack of 2,₹330,₹250,Pack of 2,4.3,"(2,323)",24% off,Bank Offer
Kapiva Aloe Vera + Wheatgrass Juice Natural Detoxifier ...,₹450,₹244,0,4.3,"(23,873)",45% off,"Buy 3 items, save extra 5%"
Kapiva Digesti Care Juice - Provides Relief From Acidit...,₹549,₹307,0,4,(382),44% off,Bank Offer
"Baidyanath 99% Pure Isabgol (Psyllium Husk), Rich sourc...",₹210,₹128,0,4.1,(55),39% off,Bank Offer
Dabur Lavanbhaskar Churna,₹262,₹188,0,4.4,(664),28% off,"Buy 3 items, save extra 5%"
Vansaar Shilajit Resin Performance Booster|15 gm ( from...,"₹1,499",₹724,0,4,(4),51% off,"Buy 3 items, save extra 5%"
Kapiva Rajasthani Neem Juice | Natural Juice made from ...,₹349,₹197,0,4.3,"(23,833)",43% off,"Buy 3 items, save extra 5%"
ISOTINE PACK OF 6 Eye Drops,₹558,₹244,10 ml,4.3,"(2,655)",56% off,Bank Offer
